{
  "batchId" : 25,
  "batchNo" : "ing-20260910204004-f0cba793",
  "runtimeProfileId" : 1,
  "source" : "local-file",
  "status" : "READY",
  "startedAt" : "2026-09-10T20:40:04.209468900",
  "finishedAt" : "2026-09-10T20:40:04.272268500",
  "files" : [ {
    "startOffset" : 0,
    "endOffset" : 18430,
    "file" : "golden-r73d-clean-20260910.jsonl",
    "quarantinedRecords" : 4,
    "acceptedRecords" : 51
  } ],
  "acceptedRecords" : 51,
  "quarantinedRecords" : 4,
  "acceptedBytes" : 17419,
  "schemaVersions" : [ "1.0" ],
  "acceptedUri" : "accepted/25",
  "quarantineUri" : "quarantine/25",
  "checksum" : "71bbde63"
}