{
  "batchId" : 18,
  "batchNo" : "ing-20260910165249-4e4db7b4",
  "runtimeProfileId" : 1,
  "source" : "local-file",
  "status" : "READY",
  "startedAt" : "2026-09-10T16:52:49.939638400",
  "finishedAt" : "2026-09-10T16:52:49.992053800",
  "files" : [ {
    "acceptedRecords" : 51,
    "startOffset" : 0,
    "endOffset" : 18430,
    "file" : "golden-r615b-20260910165249.jsonl",
    "quarantinedRecords" : 4
  } ],
  "acceptedRecords" : 51,
  "quarantinedRecords" : 4,
  "acceptedBytes" : 17419,
  "schemaVersions" : [ "1.0" ],
  "acceptedUri" : "accepted/18",
  "quarantineUri" : "quarantine/18",
  "checksum" : "71bbde63"
}