{
  "batchId" : 9,
  "batchNo" : "ing-20260907183815-6c9e0007",
  "runtimeProfileId" : 1,
  "source" : "local-file",
  "status" : "READY",
  "startedAt" : "2026-09-07T18:38:15.309103800",
  "finishedAt" : "2026-09-07T18:38:15.342941300",
  "files" : [ {
    "quarantinedRecords" : 0,
    "file" : "2026090701.jsonl",
    "endOffset" : 357988,
    "startOffset" : 356940,
    "acceptedRecords" : 3
  } ],
  "acceptedRecords" : 3,
  "quarantinedRecords" : 0,
  "acceptedBytes" : 1045,
  "schemaVersions" : [ "1.0" ],
  "acceptedUri" : "accepted/9",
  "quarantineUri" : "quarantine/9",
  "checksum" : "0"
}