{
  "batchId" : 21,
  "batchNo" : "ing-20260910195523-e61cdd84",
  "runtimeProfileId" : 1,
  "source" : "local-file",
  "status" : "READY",
  "startedAt" : "2026-09-10T19:55:23.781624400",
  "finishedAt" : "2026-09-10T19:55:23.907984900",
  "files" : [ {
    "startOffset" : 0,
    "endOffset" : 18430,
    "file" : "golden-r70-clean-20260910.jsonl",
    "quarantinedRecords" : 4,
    "acceptedRecords" : 51
  } ],
  "acceptedRecords" : 51,
  "quarantinedRecords" : 4,
  "acceptedBytes" : 17419,
  "schemaVersions" : [ "1.0" ],
  "acceptedUri" : "accepted/21",
  "quarantineUri" : "quarantine/21",
  "checksum" : "71bbde63"
}