{
  "batchId" : 44,
  "batchNo" : "ing-20260912215733-85b570e5",
  "runtimeProfileId" : 1,
  "source" : "local-file",
  "status" : "READY",
  "startedAt" : "2026-09-12T21:57:33.738279",
  "finishedAt" : "2026-09-12T21:57:33.829161800",
  "files" : [ {
    "file" : "2026091221.jsonl",
    "endOffset" : 497,
    "startOffset" : 0,
    "acceptedRecords" : 1,
    "quarantinedRecords" : 0
  } ],
  "acceptedRecords" : 1,
  "quarantinedRecords" : 0,
  "acceptedBytes" : 496,
  "schemaVersions" : [ "1.0" ],
  "acceptedUri" : "accepted/44",
  "quarantineUri" : "quarantine/44",
  "checksum" : "d3bdd2bf",
  "sourceCode" : "mock-mall",
  "sourceId" : 1,
  "profileVersion" : "1.0",
  "mappingVersion" : null
}